{
  "$schema": "dnp1-classical-v1.vectors.schema.json",
  "schemaVersion": "1.0.0",
  "status": "required-before-code",
  "decision": "DR-0003",
  "workPackage": "DNP1-PROTO-classical-identity-reset-routing",
  "cases": [
    { "id": "grammar-all-exact-lengths", "area": "grammar", "outcome": "valid", "callbacks": { "signature": 0, "agreement": 0, "network": 0, "mutation": 0 }, "purpose": "Every fixed and variable layout satisfies the registry arithmetic." },
    { "id": "grammar-truncated-max-plus-one", "area": "grammar", "outcome": "invalid-before-allocation", "callbacks": { "signature": 0, "agreement": 0, "network": 0, "mutation": 0 }, "purpose": "Truncation, overflow, hostile counts and max-plus-one fail before copying." },
    { "id": "grammar-tag-order-duplicate-trailing", "area": "grammar", "outcome": "invalid-before-allocation", "callbacks": { "signature": 0, "agreement": 0, "network": 0, "mutation": 0 }, "purpose": "Noncanonical TLV order, duplicates, flags, reserved and trailing bytes reject." },
    { "id": "grammar-unknown-suite-and-pq", "area": "grammar", "outcome": "invalid-before-allocation", "callbacks": { "signature": 0, "agreement": 0, "network": 0, "mutation": 0 }, "purpose": "Only suite 0x0001 exists in the Wave 1 public grammar." },
    { "id": "identity-role-key-reuse", "area": "identity", "outcome": "invalid-before-crypto", "callbacks": { "signature": 0, "agreement": 0, "network": 0, "mutation": 0 }, "purpose": "Account, issuer, revocation and reset-control keys are pairwise distinct." },
    { "id": "identity-pop-substitution", "area": "identity", "outcome": "invalid-before-crypto", "callbacks": { "signature": 1, "agreement": 0, "network": 0, "mutation": 0 }, "purpose": "Subject, role and key proof substitutions do not cross-authorize." },
    { "id": "identity-krt-rotate-revoke-fork", "area": "identity", "outcome": "fork-latched", "callbacks": { "signature": 1, "agreement": 0, "network": 0, "mutation": 0 }, "purpose": "Each current scope 2, 3 and 4 chain anchors its first transition to the exact subject DPA, then its prior same-scope KRT; skipped, orphaned, duplicate, cross-account, cross-scope, conflicting, KRF-successor or post-revocation use latches." },
    { "id": "identity-dxp-valid", "area": "identity", "outcome": "valid", "callbacks": { "signature": 0, "agreement": 2, "network": 0, "mutation": 0 }, "purpose": "Device and router X25519 possession transcripts derive the same proof." },
    { "id": "identity-dxp-mutation-expiry-reuse", "area": "identity", "outcome": "invalid-before-crypto", "callbacks": { "signature": 0, "agreement": 0, "network": 0, "mutation": 0 }, "purpose": "DXP role, subject, nonce, window and low-order mutations reject." },
    { "id": "revocation-empty-and-prefixes", "area": "revocation", "outcome": "valid", "callbacks": { "signature": 1, "agreement": 0, "network": 0, "mutation": 0 }, "purpose": "DRS restores every prefix head for zero through 1024 entries in O(N)." },
    { "id": "revocation-terminal-any-index", "area": "revocation", "outcome": "valid", "callbacks": { "signature": 1, "agreement": 0, "network": 0, "mutation": 0 }, "purpose": "AccountTerminal is accepted as the final entry at any index one through 1024." },
    { "id": "revocation-ordinary-entry-1024", "area": "revocation", "outcome": "invalid-before-crypto", "callbacks": { "signature": 0, "agreement": 0, "network": 0, "mutation": 0 }, "purpose": "Only AccountTerminal may occupy the last reserved entry slot." },
    { "id": "revocation-key-only-resign", "area": "revocation", "outcome": "valid", "callbacks": { "signature": 2, "agreement": 0, "network": 0, "mutation": 0 }, "purpose": "Exact key rotation may re-sign unchanged entries at revision plus one." },
    { "id": "revocation-stale-observed-snapshot", "area": "revocation", "outcome": "fail-closed", "callbacks": { "signature": 1, "agreement": 0, "network": 0, "mutation": 0 }, "purpose": "Capability creation restores current DRS and exact private DRT targets." },
    { "id": "revocation-terminal-drt-retention", "area": "revocation", "outcome": "valid", "callbacks": { "signature": 0, "agreement": 0, "network": 0, "mutation": 0 }, "purpose": "Terminal DRT compacts only after the reset cutoff and rollback horizon." },
    { "id": "reset-dra-old-new-pop", "area": "reset", "outcome": "valid", "callbacks": { "signature": 3, "agreement": 0, "network": 0, "mutation": 1 }, "purpose": "Account reset binds the exact old tuple and new account and reset key PoPs." },
    { "id": "reset-dcp-database-rollback", "area": "reset", "outcome": "fail-closed", "callbacks": { "signature": 3, "agreement": 0, "network": 1, "mutation": 0 }, "purpose": "A newer external deployment head rejects a restored older local database." },
    { "id": "reset-component-row-substitution", "area": "reset", "outcome": "invalid-before-crypto", "callbacks": { "signature": 0, "agreement": 0, "network": 0, "mutation": 0 }, "purpose": "Component kind, subject, DCP reference and schema are exact DCS rows." },
    { "id": "witness-three-of-four-valid", "area": "witness", "outcome": "valid", "callbacks": { "signature": 3, "agreement": 0, "network": 3, "mutation": 1 }, "purpose": "Three distinct authorized receipts commit one global deployment-set CAS." },
    { "id": "witness-two-of-four-insufficient", "area": "witness", "outcome": "fail-closed", "callbacks": { "signature": 2, "agreement": 0, "network": 2, "mutation": 0 }, "purpose": "Two receipts do not satisfy the Byzantine quorum." },
    { "id": "witness-equivocation-intersection", "area": "witness", "outcome": "fork-latched", "callbacks": { "signature": 4, "agreement": 0, "network": 4, "mutation": 0 }, "purpose": "Conflicting same-sequence evidence latches globally." },
    { "id": "witness-inclusion-consistency-corrupt", "area": "witness", "outcome": "fail-closed", "callbacks": { "signature": 0, "agreement": 0, "network": 0, "mutation": 0 }, "purpose": "Inclusion, consistency, prior head and durability proof corruption rejects." },
    { "id": "witness-freeze-and-lease-expiry", "area": "witness", "outcome": "fail-closed", "callbacks": { "signature": 0, "agreement": 0, "network": 3, "mutation": 0 }, "purpose": "Sensitive use stops without a fresh consistent three-witness lease." },
    { "id": "witness-four-head-lkg-rotation", "area": "witness", "outcome": "valid", "callbacks": { "signature": 4, "agreement": 0, "network": 3, "mutation": 1 }, "purpose": "DWL retains all four heads while DCL updates three and DWD rotates explicitly." },
    { "id": "membership-independent-authorities", "area": "membership", "outcome": "valid", "callbacks": { "signature": 5, "agreement": 0, "network": 0, "mutation": 0 }, "purpose": "Membership and PMA/PMR closures verify independently then join exact roots." },
    { "id": "membership-cross-authority-substitution", "area": "membership", "outcome": "invalid-before-crypto", "callbacks": { "signature": 0, "agreement": 0, "network": 0, "mutation": 0 }, "purpose": "Membership signers cannot authorize DNRC and PMA issuers cannot add members." },
    { "id": "membership-mrl-v1-v2-cross-feed", "area": "membership", "outcome": "invalid-before-crypto", "callbacks": { "signature": 0, "agreement": 0, "network": 0, "mutation": 0 }, "purpose": "Reset, epoch, generation and protocol domains prevent root cross-feed." },
    { "id": "routing-dpc-anchor-and-successor", "area": "routing", "outcome": "valid", "callbacks": { "signature": 2, "agreement": 0, "network": 0, "mutation": 0 }, "purpose": "DPC advances exactly from the canonical MRL2 anchor DPC hash." },
    { "id": "routing-dns-private-mixed-rebind", "area": "routing", "outcome": "fail-closed", "callbacks": { "signature": 1, "agreement": 0, "network": 1, "mutation": 0 }, "purpose": "Malformed DNS, private or mixed answers and second resolution reject." },
    { "id": "routing-remote-ip-and-spki", "area": "routing", "outcome": "fail-closed", "callbacks": { "signature": 1, "agreement": 0, "network": 1, "mutation": 0 }, "purpose": "Connected IP and TLS SPKI remain pinned to the verified DPC." },
    { "id": "peer-sender-recipient-dpc-swap", "area": "peer", "outcome": "invalid-before-crypto", "callbacks": { "signature": 0, "agreement": 0, "network": 0, "mutation": 0 }, "purpose": "DPR and DPS bind both exact sender and recipient contacts." },
    { "id": "peer-prq-request-id-window-hash", "area": "peer", "outcome": "invalid-before-crypto", "callbacks": { "signature": 0, "agreement": 0, "network": 0, "mutation": 0 }, "purpose": "Outer request ID, identities, operation, window and PRQ2 hash are exact." },
    { "id": "peer-dps-mrr2-not-mqr3", "area": "peer", "outcome": "valid", "callbacks": { "signature": 2, "agreement": 0, "network": 0, "mutation": 1 }, "purpose": "A successful DPS wraps one exact 296-byte MRR2 and rejects MQR3." },
    { "id": "peer-inner-commit-outer-lost-response", "area": "peer", "outcome": "exact-replay", "callbacks": { "signature": 1, "agreement": 0, "network": 0, "mutation": 0 }, "purpose": "Recovery uses inner exact replay then outer CAS without a new mutation." },
    { "id": "peer-http-framing-compression-trailing", "area": "peer", "outcome": "invalid-before-allocation", "callbacks": { "signature": 0, "agreement": 0, "network": 0, "mutation": 0 }, "purpose": "Exact media, lengths and identity encoding reject ambiguous bodies." },
    { "id": "recovery-before-prepare", "area": "recovery", "outcome": "exact-replay", "callbacks": { "signature": 0, "agreement": 0, "network": 0, "mutation": 0 }, "purpose": "A pre-CAS crash leaves the old active state and discards shadow safely." },
    { "id": "recovery-after-cas-before-commit", "area": "recovery", "outcome": "exact-replay", "callbacks": { "signature": 0, "agreement": 0, "network": 3, "mutation": 1 }, "purpose": "Valid shadow and capsule complete the committed external head idempotently." },